[
  {
    "passageId": "pass-gettysburg-dead-not-vain",
    "sourceId": "src-gettysburg-address",
    "locator": "final sentence",
    "text": "that these dead shall not have died in vain",
    "textStatus": "verified",
    "notes": "Short public-domain excerpt used as a pilot anchor."
  },
  {
    "passageId": "pass-pilot-scope",
    "sourceId": "src-methodological-pilot-note",
    "locator": "scope statement",
    "text": "The pilot tests attribution criteria and does not presume that rhetorical obligation proves institutional or spiritual agency.",
    "textStatus": "verified",
    "notes": ""
  }
]
